[
  {
    "order_id": "ORD-10000",
    "customer_id": "CUST-101",
    "status": "SHIPPED",
    "priority": "NORMAL",
    "total_items": 5,
    "total_value": 245.5,
    "shipping_address": "123 Main St, NY",
    "created_at": "2024-08-01T10:00:00Z",
    "promised_date": "2024-08-03T10:00:00Z",
    "carrier": "UPS",
    "tracking_number": "1Z999AA10123456784"
  },
  {
    "order_id": "ORD-10001",
    "customer_id": "CUST-205",
    "status": "PICKING",
    "priority": "HIGH",
    "total_items": 12,
    "total_value": 1890.0,
    "shipping_address": "456 Oak Ave, CA",
    "created_at": "2024-08-05T08:30:00Z",
    "promised_date": "2024-08-06T08:30:00Z",
    "carrier": "",
    "tracking_number": ""
  },
  {
    "order_id": "ORD-10002",
    "customer_id": "CUST-312",
    "status": "PENDING",
    "priority": "URGENT",
    "total_items": 3,
    "total_value": 89.99,
    "shipping_address": "789 Pine Rd, TX",
    "created_at": "2024-08-05T14:00:00Z",
    "promised_date": "2024-08-06T14:00:00Z",
    "carrier": "",
    "tracking_number": ""
  }
]